<?xml version = "1.0"  encoding = "utf-8"?>
<!DOCTYPE car_catalog SYSTEM "car_catalog.dtd">
<car_catalog>
    <car>
        <year>2014</year>
        <make>BMV</make>
        <model>X6</model>
        <color>Black Sapphire (metallic)</color>
        <engine>
            <Petrol number_of_cylinders="6 cylinder" fuel_system="TwinPower Turbo Inline"
                    transmission_type="Automatic" number_of_gears="8 speed" drive_train="4WD"
                    fuel_tank_capacity="85.0 liters" maximum_speed="240 Kmph"/>
        </engine>
        <number_of_doors>5</number_of_doors>
        <accessories>
            <Items radio="yes" air_conditioner="yes" cruise_control="yes"
                   climate_control="yes" rear_parking_sensor="yes" cornering_lights="yes"/>
        </accessories>
    </car>
    <car>
        <year>2016</year>
        <make>Audi</make>
        <model>Q7</model>
        <color>Ice Silver</color>
        <engine>
            <Diesel number_of_cylinders="6 cylinder"
                    fuel_system="Common Rail Injection System And Turbocharging"
                    transmission_type="Automatic" number_of_gears="8 speed" drive_train="AWD"
                    fuel_tank_capacity="75.0 liters" maximum_speed="234 Kmpl"/>
        </engine>
        <number_of_doors>5</number_of_doors>
        <accessories>
            <Items radio="yes" air_conditioner="yes"
                   cruise_control="yes" climate_control="yes"
                   rear_parking_sensor="yes" cornering_lights="no"/>
        </accessories>
    </car>
    <car>
        <year>2016</year>
        <make>Land Rover</make>
        <model>Range Rover Sport</model>
        <color>Blue</color>
        <engine>
            <Petrol number_of_cylinders="6 cylinder" fuel_system="3.0L V-Type Engine"
                    transmission_type="Automatic" number_of_gears="8 speed" drive_train="4WD"
                    fuel_tank_capacity="105.0 liters" maximum_speed="210 Kmpl"/>
        </engine>
        <number_of_doors>5</number_of_doors>
        <accessories>
            <Items radio="yes" air_conditioner="yes"
                   cruise_control="yes" climate_control="yes"
                   rear_parking_sensor="yes" cornering_lights="no"/>
        </accessories>
    </car>
</car_catalog>